{"canonicalization":"utf8-json-sorted-keys-compact-v1","claim_level":"local_robustness","comparison_semantics":{"local_values":"same-manifest_repeated_measurements","paper_values":"reference_only_not_pooled","quantile_method":"linear_type_7"},"exact_reproduction_claim":false,"experiment_id":"synthetic-deformation-only-r16-h0","local_metric_aggregates":[{"iqr":0.0,"maximum":0.0,"median":0.0,"minimum":0.0,"name":"algorithm_success","q1":0.0,"q3":0.0,"sample_count":5,"semantics":"One when the native result classifies the optimization outcome as successful.","source":"local_measurement","unit":"indicator"},{"iqr":0.0,"maximum":0.0,"median":0.0,"minimum":0.0,"name":"carving_iteration_count","q1":0.0,"q3":0.0,"sample_count":5,"semantics":"Count of recorded carving iterations under the modern controller semantics.","source":"local_measurement","unit":"iterations"},{"iqr":0.0,"maximum":23.0,"median":23.0,"minimum":23.0,"name":"committed_event_count","q1":23.0,"q3":23.0,"sample_count":5,"semantics":"Count of committed R10 geometry states, including the initial state.","source":"local_measurement","unit":"events"},{"iqr":0.0,"maximum":3.706987501446273e-05,"median":3.706987501446273e-05,"minimum":3.706987501446273e-05,"name":"deformation_energy","q1":3.706987501446273e-05,"q3":3.706987501446273e-05,"sample_count":5,"semantics":"Final unscaled Laplacian shape energy reported by the R10 diagnostics.","source":"local_measurement","unit":"normalized_objective"},{"iqr":0.0,"maximum":46.0,"median":46.0,"minimum":46.0,"name":"deformation_iteration_count","q1":46.0,"q3":46.0,"sample_count":5,"semantics":"Count of recorded deformation line-search iterations.","source":"local_measurement","unit":"iterations"},{"iqr":0.0,"maximum":0.0,"median":0.0,"minimum":0.0,"name":"final_cavity_volume_fraction","q1":0.0,"q3":0.0,"sample_count":5,"semantics":"Final inward cavity volume divided by final outer-envelope volume; reported only for an empty or strictly valid inner boundary.","source":"local_measurement","unit":"fraction"},{"iqr":0.0,"maximum":0.0,"median":0.0,"minimum":0.0,"name":"manufacturing_ready","q1":0.0,"q3":0.0,"sample_count":5,"semantics":"One when the sealed manufacturing audit reports ready.","source":"local_measurement","unit":"indicator"},{"iqr":0.0,"maximum":0.03148878191853061,"median":0.03148878191853061,"minimum":0.03148878191853061,"name":"material_mass_change_fraction","q1":0.03148878191853061,"q3":0.03148878191853061,"sample_count":5,"semantics":"Initial material mass minus final material mass, divided by initial material mass; deformation can make this value negative.","source":"local_measurement","unit":"fraction"},{"iqr":0.0,"maximum":0.012357052664436652,"median":0.012357052664436652,"minimum":0.012357052664436652,"name":"maximum_handle_scale_deviation","q1":0.012357052664436652,"q3":0.012357052664436652,"sample_count":5,"semantics":"Maximum absolute deviation of a user-handle uniform scale from one.","source":"local_measurement","unit":"fraction"},{"iqr":0.0,"maximum":0.02103018975724039,"median":0.02103018975724039,"minimum":0.02103018975724039,"name":"normalized_maximum_displacement","q1":0.02103018975724039,"q3":0.02103018975724039,"sample_count":5,"semantics":"Maximum source-vertex displacement divided by the maximum source bounding-box extent.","source":"local_measurement","unit":"normalized_length"},{"iqr":0.0,"maximum":0.01339477394126643,"median":0.01339477394126643,"minimum":0.01339477394126643,"name":"normalized_rms_displacement","q1":0.01339477394126643,"q3":0.01339477394126643,"sample_count":5,"semantics":"RMS source-vertex displacement divided by the maximum source bounding-box extent.","source":"local_measurement","unit":"normalized_length"},{"iqr":0.0,"maximum":1.1988562984184886e-07,"median":1.1988562984184886e-07,"minimum":1.1988562984184886e-07,"name":"projected_target_energy","q1":1.1988562984184886e-07,"q3":1.1988562984184886e-07,"sample_count":5,"semantics":"Final projected balance-target energy reported by the R10 diagnostics.","source":"local_measurement","unit":"normalized_objective"},{"iqr":0.0,"maximum":0.0,"median":0.0,"minimum":0.0,"name":"targets_reached","q1":0.0,"q3":0.0,"sample_count":5,"semantics":"One when all declared final balance targets are reached.","source":"local_measurement","unit":"indicator"}],"manifest_sha256":"48df010e6536ac8daef256be860cb4060e2532dabfdd721d9cfcd4577cda242a","paper_reference_metrics":[],"repeat_count":5,"run_record_sha256s":["3378f5553a76c65be4cd7f11d007888f0d118d5af38d81dbff5964228122c941","51b5af19fd2caad4635681baf0ca3a837dbb85180c0fc0374a3bf7127728b1dc","65d12ca18f588015651753c7cc3de815ebd5d814312e455964505e64c024c579","cd04b6dd386988253526d62d21e2a96c9fb55b61b3759280bb1dec5b9c0f1571","f925c30634832e3c9ccd5851f7fc2259da913aaf97b239e9232b0ee9ca01783c"],"schema":"make-it-stand-r10-aggregate-v1","schema_version":1,"status_counts":{"succeeded":5},"successful_repeat_count":5,"timing_aggregates":[{"iqr":0.00039139576256275177,"maximum":0.019687853986397386,"median":0.01876783510670066,"minimum":0.017883779015392065,"name":"artifact_export","q1":0.018421011045575142,"q3":0.018812406808137894,"sample_count":5,"unit":"seconds"},{"iqr":1.1179829016327858e-05,"maximum":0.0002782018855214119,"median":0.00026504206471145153,"minimum":0.000256591010838747,"name":"model_setup","q1":0.0002647009678184986,"q3":0.00027588079683482647,"sample_count":5,"unit":"seconds"},{"iqr":0.0005642338655889034,"maximum":0.12779993005096912,"median":0.1266362010501325,"minimum":0.1260072640143335,"name":"native_optimize_call","q1":0.12620026315562427,"q3":0.12676449702121317,"sample_count":5,"unit":"seconds"},{"iqr":0.0006467658095061779,"maximum":0.14813035097904503,"median":0.14672020194120705,"minimum":0.14605048415251076,"name":"total","q1":0.14657299616374075,"q3":0.14721976197324693,"sample_count":5,"unit":"seconds"}]}